{
  "player_info": {
    "display_name": "Taylor",
    "pronouns": "she_her"
  },
  "premise": {
    "facets": {
      "creativity": 0.95,
      "empathy": 0.85
    },
    "last_bias_update": null
  },
  "state": {
    "current_location": null,
    "inventory": [
      "chamomile_flowers",
      "journal"
    ],
    "inventory_counts": {},
    "visit_counts": {},
    "seen_interactions": {},
    "flags": [],
    "relationships": {},
    "journaling_enabled": true
  },
  "player_id": "251047aa4b6a474498f2accd825f18cf"
}
